{
  "cutoff_at": "2026-08-24T00:00:00.000Z",
  "historical_replay_report_sha256": "eeeeeeeeeeeeeeeeeeeeeeeeeeeeeeeeeeeeeeeeeeeeeeeeeeeeeeeeeeeeeeee",
  "inventory_id": "kci1_e95aa7449750fe408e1f131f98bae4d70c173fc9732cad2c38ee0b2ef7c0fc3f",
  "results": [
    {
      "authoritative_outcome": "accepted",
      "availability": "ready",
      "replay_attempt_id": "rt1_0000000000000000000000000000000000000000000000000000000000000001",
      "result_id": "r2_0000000000000000000000000000000000000000000000000000000000000000",
      "unavailability_evidence_sha256": null
    },
    {
      "authoritative_outcome": "rejected",
      "availability": "ready",
      "replay_attempt_id": "rt1_0000000000000000000000000000000000000000000000000000000000000002",
      "result_id": "r2_1111111111111111111111111111111111111111111111111111111111111111",
      "unavailability_evidence_sha256": null
    },
    {
      "authoritative_outcome": null,
      "availability": "source_unavailable",
      "replay_attempt_id": "rt1_0000000000000000000000000000000000000000000000000000000000000008",
      "result_id": "r2_7777777777777777777777777777777777777777777777777777777777777777",
      "unavailability_evidence_sha256": "aaaaaaaaaaaaaaaaaaaaaaaaaaaaaaaaaaaaaaaaaaaaaaaaaaaaaaaaaaaaaaaa"
    },
    {
      "authoritative_outcome": null,
      "availability": "replay_pending",
      "replay_attempt_id": "rt1_000000000000000000000000000000000000000000000000000000000000000a",
      "result_id": "r2_9999999999999999999999999999999999999999999999999999999999999999",
      "unavailability_evidence_sha256": null
    }
  ],
  "results_store": {
    "commit": "cccccccccccccccccccccccccccccccccccccccc",
    "repository": "leanprover/lean-eval-submissions",
    "tree_sha256": "dddddddddddddddddddddddddddddddddddddddddddddddddddddddddddddddd"
  },
  "schema_version": 1
}
